Gene_set,Term,Overlap,P-value,Adjusted P-value,Old P-value,Old Adjusted P-value,Odds Ratio,Combined Score,Genes
GO_Biological_Process_2023,Regulation Of JUN Kinase Activity (GO:0043506),1/43,0.4078683099694653,0.4937933016713378,0,0,1.947836395969176,1.7468409626707435,GSTP1
GO_Biological_Process_2023,Regulation Of Cellular Component Size (GO:0032535),1/43,0.4078683099694653,0.4937933016713378,0,0,1.947836395969176,1.7468409626707435,BLOC1S1
GO_Biological_Process_2023,Transcription By RNA Polymerase II (GO:0006366),3/192,0.4110201025831113,0.4972733089956266,0,0,1.299661287108986,1.155545946486945,GTF2A1;NFAT5;PIR
GO_Biological_Process_2023,Autophagosome Maturation (GO:0097352),1/44,0.4150485272771468,0.4997864401665038,0,0,1.9024413779793496,1.672930531271052,LIX1
GO_Biological_Process_2023,Cellular Response To Ketone (GO:1901655),1/44,0.4150485272771468,0.4997864401665038,0,0,1.9024413779793496,1.672930531271052,ADCY2
GO_Biological_Process_2023,Regulation Of Transport (GO:0051049),1/44,0.4150485272771468,0.4997864401665038,0,0,1.9024413779793496,1.672930531271052,CLDN10
GO_Biological_Process_2023,Regulation Of Viral Entry Into Host Cell (GO:0046596),1/44,0.4150485272771468,0.4997864401665038,0,0,1.9024413779793496,1.672930531271052,GSN
GO_Biological_Process_2023,Extracellular Matrix Disassembly (GO:0022617),1/44,0.4150485272771468,0.4997864401665038,0,0,1.9024413779793496,1.672930531271052,GSN
GO_Biological_Process_2023,Positive Regulation Of Biosynthetic Process (GO:0009891),1/44,0.4150485272771468,0.4997864401665038,0,0,1.9024413779793496,1.672930531271052,APOE
GO_Biological_Process_2023,Regulation Of B Cell Proliferation (GO:0030888),1/44,0.4150485272771468,0.4997864401665038,0,0,1.9024413779793496,1.672930531271052,BCL2
GO_Biological_Process_2023,Positive Regulation Of Cell Cycle Process (GO:0090068),2/118,0.4190401775833986,0.5042543881926401,0,0,1.4110632183908045,1.2273265240576732,SMC4;CDC14A
GO_Biological_Process_2023,Regulation Of Cellular Metabolic Process (GO:0031323),1/45,0.4221420321464255,0.5049370671371186,0,0,1.859109769898152,1.6033212752444392,MPV17
GO_Biological_Process_2023,Regulation Of Stem Cell Differentiation (GO:2000736),1/45,0.4221420321464255,0.5049370671371186,0,0,1.859109769898152,1.6033212752444392,PTN
GO_Biological_Process_2023,Epidermal Growth Factor Receptor Signaling Pathway (GO:0007173),1/45,0.4221420321464255,0.5049370671371186,0,0,1.859109769898152,1.6033212752444392,SOX9
GO_Biological_Process_2023,Triglyceride Metabolic Process (GO:0006641),1/45,0.4221420321464255,0.5049370671371186,0,0,1.859109769898152,1.6033212752444392,APOE
GO_Biological_Process_2023,Hexose Metabolic Process (GO:0019318),1/45,0.4221420321464255,0.5049370671371186,0,0,1.859109769898152,1.6033212752444392,ALDOC
GO_Biological_Process_2023,Zymogen Activation (GO:0031638),1/45,0.4221420321464255,0.5049370671371186,0,0,1.859109769898152,1.6033212752444392,VSIR
GO_Biological_Process_2023,Mitotic Nuclear Division (GO:0140014),1/45,0.4221420321464255,0.5049370671371186,0,0,1.859109769898152,1.6033212752444392,SMC4
GO_Biological_Process_2023,Natural Killer Cell Activation (GO:0030101),1/45,0.4221420321464255,0.5049370671371186,0,0,1.859109769898152,1.6033212752444392,PRDX1
GO_Biological_Process_2023,Organic Hydroxy Compound Transport (GO:0015850),1/45,0.4221420321464255,0.5049370671371186,0,0,1.859109769898152,1.6033212752444392,ABCC4
GO_Biological_Process_2023,Protein Ubiquitination (GO:0016567),6/434,0.4287822335949756,0.5082336277682733,0,0,1.1482258830983685,0.9723246853515488,UBB;BCL2;ARRB1;UBA52;PDZRN3;HERC6
GO_Biological_Process_2023,B Cell Receptor Signaling Pathway (GO:0050853),1/46,0.4291498675076217,0.5082336277682733,0,0,1.817704011065007,1.5376850350548763,BCL2
GO_Biological_Process_2023,Regulation Of Cytokine Production Involved In Inflammatory Response (GO:1900015),1/46,0.4291498675076217,0.5082336277682733,0,0,1.817704011065007,1.5376850350548763,SIRPA
GO_Biological_Process_2023,Regulation Of Fibroblast Proliferation (GO:0048145),1/46,0.4291498675076217,0.5082336277682733,0,0,1.817704011065007,1.5376850350548763,GSTP1
GO_Biological_Process_2023,Regulation Of Interleukin-10 Production (GO:0032653),1/46,0.4291498675076217,0.5082336277682733,0,0,1.817704011065007,1.5376850350548763,VSIR
GO_Biological_Process_2023,Regulation Of mRNA Catabolic Process (GO:0061013),1/46,0.4291498675076217,0.5082336277682733,0,0,1.817704011065007,1.5376850350548763,ZC3HAV1
GO_Biological_Process_2023,Antiviral Innate Immune Response (GO:0140374),1/46,0.4291498675076217,0.5082336277682733,0,0,1.817704011065007,1.5376850350548763,IFIT3
GO_Biological_Process_2023,Cardiac Conduction (GO:0061337),1/46,0.4291498675076217,0.5082336277682733,0,0,1.817704011065007,1.5376850350548763,CACNB2
GO_Biological_Process_2023,Cellular Component Disassembly (GO:0022411),1/46,0.4291498675076217,0.5082336277682733,0,0,1.817704011065007,1.5376850350548763,GSN
GO_Biological_Process_2023,Development Of Primary Male Sexual Characteristics (GO:0046546),1/46,0.4291498675076217,0.5082336277682733,0,0,1.817704011065007,1.5376850350548763,SOX9
GO_Biological_Process_2023,Epithelial Cell Migration (GO:0010631),1/46,0.4291498675076217,0.5082336277682733,0,0,1.817704011065007,1.5376850350548763,STAT1
GO_Biological_Process_2023,Vacuolar Transport (GO:0007034),1/46,0.4291498675076217,0.5082336277682733,0,0,1.817704011065007,1.5376850350548763,PSAP
GO_Biological_Process_2023,Male Gonad Development (GO:0008584),1/46,0.4291498675076217,0.5082336277682733,0,0,1.817704011065007,1.5376850350548763,SOX9
GO_Biological_Process_2023,Myofibril Assembly (GO:0030239),1/46,0.4291498675076217,0.5082336277682733,0,0,1.817704011065007,1.5376850350548763,CSRP1
GO_Biological_Process_2023,Negative Regulation Of Cellular Metabolic Process (GO:0031324),1/46,0.4291498675076217,0.5082336277682733,0,0,1.817704011065007,1.5376850350548763,MT3
GO_Biological_Process_2023,Regulation Of Protein Catabolic Process (GO:0042176),2/122,0.4356359627314645,0.513380829444636,0,0,1.36375,1.133205788119343,UBB;APOE
GO_Biological_Process_2023,Positive Regulation Of Macromolecule Biosynthetic Process (GO:0010557),2/122,0.4356359627314645,0.513380829444636,0,0,1.36375,1.133205788119343,SSB;CPEB3
GO_Biological_Process_2023,Receptor-Mediated Endocytosis (GO:0006898),2/122,0.4356359627314645,0.513380829444636,0,0,1.36375,1.133205788119343,APOE;EPS15
GO_Biological_Process_2023,Golgi To Plasma Membrane Transport (GO:0006893),1/47,0.4360730637167767,0.513380829444636,0,0,1.778098502615912,1.4757248016216031,VAMP5
GO_Biological_Process_2023,Bicellular Tight Junction Assembly (GO:0070830),1/47,0.4360730637167767,0.513380829444636,0,0,1.778098502615912,1.4757248016216031,CLDN10
GO_Biological_Process_2023,Response To Organonitrogen Compound (GO:0010243),1/47,0.4360730637167767,0.513380829444636,0,0,1.778098502615912,1.4757248016216031,CLU
GO_Biological_Process_2023,Secondary Alcohol Metabolic Process (GO:1902652),1/47,0.4360730637167767,0.513380829444636,0,0,1.778098502615912,1.4757248016216031,APOE
GO_Biological_Process_2023,Positive Regulation Of Epithelial To Mesenchymal Transition (GO:0010718),1/47,0.4360730637167767,0.513380829444636,0,0,1.778098502615912,1.4757248016216031,MDK
GO_Biological_Process_2023,Regulation Of T Cell Differentiation (GO:0045580),1/47,0.4360730637167767,0.513380829444636,0,0,1.778098502615912,1.4757248016216031,MDK
GO_Biological_Process_2023,Regulation Of Intrinsic Apoptotic Signaling Pathway (GO:2001242),1/48,0.4429126388099595,0.5197266762999067,0,0,1.740178334951885,1.4171711865391117,BCL2
GO_Biological_Process_2023,Cellular Response To Mechanical Stimulus (GO:0071260),1/48,0.4429126388099595,0.5197266762999067,0,0,1.740178334951885,1.4171711865391117,SOX9
GO_Biological_Process_2023,Regulation Of Tumor Necrosis Factor-Mediated Signaling Pathway (GO:0010803),1/48,0.4429126388099595,0.5197266762999067,0,0,1.740178334951885,1.4171711865391117,GSTP1
GO_Biological_Process_2023,Post-Translational Protein Modification (GO:0043687),1/48,0.4429126388099595,0.5197266762999067,0,0,1.740178334951885,1.4171711865391117,ZC3HAV1
GO_Biological_Process_2023,Regulation Of DNA Binding (GO:0051101),1/48,0.4429126388099595,0.5197266762999067,0,0,1.740178334951885,1.4171711865391117,HMGB2
GO_Biological_Process_2023,Unsaturated Fatty Acid Metabolic Process (GO:0033559),1/49,0.4496695987971376,0.5266215484279998,0,0,1.7038381742738589,1.3617793551550852,GSTP1
GO_Biological_Process_2023,Intrinsic Apoptotic Signaling Pathway In Response To DNA Damage (GO:0008630),1/49,0.4496695987971376,0.5266215484279998,0,0,1.7038381742738589,1.3617793551550852,BCL2
GO_Biological_Process_2023,Negative Regulation Of DNA Metabolic Process (GO:0051053),1/49,0.4496695987971376,0.5266215484279998,0,0,1.7038381742738589,1.3617793551550852,DACH1
GO_Biological_Process_2023,Protein Modification By Small Protein Conjugation (GO:0032446),5/364,0.4508224765911299,0.5276270891174255,0,0,1.1400044662270958,0.9082206262996324,UBB;ARRB1;UBA52;PDZRN3;HERC6
GO_Biological_Process_2023,Positive Regulation Of Intracellular Signal Transduction (GO:1902533),7/525,0.4511869901906581,0.5277092455393673,0,0,1.1063829787234043,0.8805407973741933,BST2;NFAT5;LPAR1;IL18;SOX9;GPR37L1;PPIA
GO_Biological_Process_2023,Positive Regulation Of Intracellular Protein Transport (GO:0090316),2/126,0.451973888630589,0.5279408353841343,0,0,1.319489247311828,1.0478471430458831,TCAF1;FZD5
GO_Biological_Process_2023,Protein-Containing Complex Organization (GO:0043933),2/126,0.451973888630589,0.5279408353841343,0,0,1.319489247311828,1.0478471430458831,PDE4DIP;SOX9
GO_Biological_Process_2023,Cytosolic Transport (GO:0016482),2/127,0.4560165119702952,0.5295964224146608,0,0,1.3088666666666666,1.027756477063146,EEA1;EPS15
GO_Biological_Process_2023,Regulation Of Interferon-Beta Production (GO:0032648),1/50,0.4563449373288627,0.5295964224146608,0,0,1.6689812854602422,1.3093263562491473,SIRPA
GO_Biological_Process_2023,Regulation Of Mitochondrion Organization (GO:0010821),1/50,0.4563449373288627,0.5295964224146608,0,0,1.6689812854602422,1.3093263562491473,FZD5
GO_Biological_Process_2023,tRNA Processing (GO:0008033),1/50,0.4563449373288627,0.5295964224146608,0,0,1.6689812854602422,1.3093263562491473,SSB
GO_Biological_Process_2023,Intracellular Iron Ion Homeostasis (GO:0006879),1/50,0.4563449373288627,0.5295964224146608,0,0,1.6689812854602422,1.3093263562491473,B2M
GO_Biological_Process_2023,Plasma Membrane Bounded Cell Projection Morphogenesis (GO:0120039),1/50,0.4563449373288627,0.5295964224146608,0,0,1.6689812854602422,1.3093263562491473,UBB
GO_Biological_Process_2023,Positive Regulation Of Developmental Growth (GO:0048639),1/50,0.4563449373288627,0.5295964224146608,0,0,1.6689812854602422,1.3093263562491473,PLCB1
GO_Biological_Process_2023,Positive Regulation Of Fat Cell Differentiation (GO:0045600),1/50,0.4563449373288627,0.5295964224146608,0,0,1.6689812854602422,1.3093263562491473,FRZB
GO_Biological_Process_2023,Positive Regulation Of Transport (GO:0051050),1/50,0.4563449373288627,0.5295964224146608,0,0,1.6689812854602422,1.3093263562491473,APOE
GO_Biological_Process_2023,Regulation Of TORC1 Signaling (GO:1903432),1/50,0.4563449373288627,0.5295964224146608,0,0,1.6689812854602422,1.3093263562491473,DEPTOR
GO_Biological_Process_2023,Negative Regulation Of Cell Differentiation (GO:0045596),3/207,0.4588383494887686,0.5321456407719031,0,0,1.2031749938469112,0.9373422750252856,PTCH1;SOX9;RORB
GO_Biological_Process_2023,Amide Biosynthetic Process (GO:0043604),1/51,0.4629396363936863,0.5344821429838246,0,0,1.63551867219917,1.25960878451969,PAM
GO_Biological_Process_2023,Regulation Of Smoothened Signaling Pathway (GO:0008589),1/51,0.4629396363936863,0.5344821429838246,0,0,1.63551867219917,1.25960878451969,PTCH1
GO_Biological_Process_2023,Regulation Of Substrate Adhesion-Dependent Cell Spreading (GO:1900024),1/51,0.4629396363936863,0.5344821429838246,0,0,1.63551867219917,1.25960878451969,MDK
GO_Biological_Process_2023,Positive Regulation Of Actin Filament Bundle Assembly (GO:0032233),1/51,0.4629396363936863,0.5344821429838246,0,0,1.63551867219917,1.25960878451969,LPAR1
GO_Biological_Process_2023,Positive Regulation Of Leukocyte Mediated Cytotoxicity (GO:0001912),1/51,0.4629396363936863,0.5344821429838246,0,0,1.63551867219917,1.25960878451969,CADM1
GO_Biological_Process_2023,Receptor Internalization (GO:0031623),1/51,0.4629396363936863,0.5344821429838246,0,0,1.63551867219917,1.25960878451969,ARRB1
GO_Biological_Process_2023,Regulated Exocytosis (GO:0045055),1/51,0.4629396363936863,0.5344821429838246,0,0,1.63551867219917,1.25960878451969,ABCC4
GO_Biological_Process_2023,Positive Regulation Of Transcription By RNA Polymerase II (GO:0045944),12/938,0.4636247243567452,0.5349286555802086,0,0,1.0610573762794628,0.8156134118014038,GTF2A1;NFAT5;FZD5;PRRX1;STAT1;IL18;HMGB2;ARRB1;SOX9;NR1D1;RORB;JUNB
GO_Biological_Process_2023,Positive Regulation Of Peptidyl-Tyrosine Phosphorylation (GO:0050731),2/130,0.468040926950827,0.5388810604613783,0,0,1.2779947916666667,0.9702530530206932,IL15;IL18
GO_Biological_Process_2023,Rho Protein Signal Transduction (GO:0007266),1/52,0.4694546661688081,0.5388810604613783,0,0,1.6033683182816696,1.2124407351338675,ARHGAP6
GO_Biological_Process_2023,Cartilage Development (GO:0051216),1/52,0.4694546661688081,0.5388810604613783,0,0,1.6033683182816696,1.2124407351338675,SOX9
GO_Biological_Process_2023,Regulation Of Proteolysis (GO:0030162),1/52,0.4694546661688081,0.5388810604613783,0,0,1.6033683182816696,1.2124407351338675,CST3
GO_Biological_Process_2023,Sprouting Angiogenesis (GO:0002040),1/52,0.4694546661688081,0.5388810604613783,0,0,1.6033683182816696,1.2124407351338675,CCBE1
GO_Biological_Process_2023,Negative Regulation Of Response To Stimulus (GO:0048585),1/52,0.4694546661688081,0.5388810604613783,0,0,1.6033683182816696,1.2124407351338675,CLU
GO_Biological_Process_2023,Positive Regulation Of Telomere Maintenance (GO:0032206),1/52,0.4694546661688081,0.5388810604613783,0,0,1.6033683182816696,1.2124407351338675,HNRNPA2B1
GO_Biological_Process_2023,Positive Regulation Of Transcription Initiation By RNA Polymerase II (GO:0060261),1/52,0.4694546661688081,0.5388810604613783,0,0,1.6033683182816696,1.2124407351338675,GTF2A1
GO_Biological_Process_2023,Actin Cytoskeleton Reorganization (GO:0031532),1/53,0.4758909850868232,0.5428835482144605,0,0,1.572454516437919,1.1676520056509367,S1PR1
GO_Biological_Process_2023,Blood Vessel Morphogenesis (GO:0048514),1/53,0.4758909850868232,0.5428835482144605,0,0,1.572454516437919,1.1676520056509367,CCBE1
GO_Biological_Process_2023,Carboxylic Acid Transport (GO:0046942),1/53,0.4758909850868232,0.5428835482144605,0,0,1.572454516437919,1.1676520056509367,PSAP
GO_Biological_Process_2023,Endosome Organization (GO:0007032),1/53,0.4758909850868232,0.5428835482144605,0,0,1.572454516437919,1.1676520056509367,EEA1
GO_Biological_Process_2023,Tight Junction Assembly (GO:0120192),1/53,0.4758909850868232,0.5428835482144605,0,0,1.572454516437919,1.1676520056509367,CLDN10
GO_Biological_Process_2023,Gonad Development (GO:0008406),1/53,0.4758909850868232,0.5428835482144605,0,0,1.572454516437919,1.1676520056509367,SOX9
GO_Biological_Process_2023,Positive Regulation Of NIK/NF-kappaB Signaling (GO:1901224),1/53,0.4758909850868232,0.5428835482144605,0,0,1.572454516437919,1.1676520056509367,NFAT5
GO_Biological_Process_2023,Positive Regulation Of Chemokine Production (GO:0032722),1/53,0.4758909850868232,0.5428835482144605,0,0,1.572454516437919,1.1676520056509367,IL18
GO_Biological_Process_2023,"Regulation Of Alternative mRNA Splicing, Via Spliceosome (GO:0000381)",1/53,0.4758909850868232,0.5428835482144605,0,0,1.572454516437919,1.1676520056509367,DDX5
GO_Biological_Process_2023,Epithelial Cell Differentiation (GO:0030855),2/132,0.4759692904590807,0.5428835482144605,0,0,1.2582051282051283,0.9340939314621542,ALDOC;CTSB
GO_Biological_Process_2023,mRNA Processing (GO:0006397),3/214,0.4805941096585277,0.5465698012802939,0,0,1.1628428087013425,0.8520523834039916,DDX5;HNRNPA3;HNRNPA2B1
GO_Biological_Process_2023,ERBB Signaling Pathway (GO:0038127),1/54,0.4822495402261153,0.5465698012802939,0,0,1.54270727315431,1.125086511040914,SOX9
GO_Biological_Process_2023,Regulation Of Exocytosis (GO:0017157),1/54,0.4822495402261153,0.5465698012802939,0,0,1.54270727315431,1.125086511040914,STXBP6
GO_Biological_Process_2023,Regulation Of Focal Adhesion Assembly (GO:0051893),1/54,0.4822495402261153,0.5465698012802939,0,0,1.54270727315431,1.125086511040914,ARHGAP6
GO_Biological_Process_2023,Apical Junction Assembly (GO:0043297),1/54,0.4822495402261153,0.5465698012802939,0,0,1.54270727315431,1.125086511040914,CLDN10
GO_Biological_Process_2023,Negative Regulation Of TOR Signaling (GO:0032007),1/54,0.4822495402261153,0.5465698012802939,0,0,1.54270727315431,1.125086511040914,DEPTOR
GO_Biological_Process_2023,Negative Regulation Of Protein Modification By Small Protein Conjugation Or Removal (GO:1903321),1/54,0.4822495402261153,0.5465698012802939,0,0,1.54270727315431,1.125086511040914,ARRB1
GO_Biological_Process_2023,Negative Regulation Of Protein Ubiquitination (GO:0031397),1/54,0.4822495402261153,0.5465698012802939,0,0,1.54270727315431,1.125086511040914,ARRB1
GO_Biological_Process_2023,Peptidyl-Tyrosine Modification (GO:0018212),1/54,0.4822495402261153,0.5465698012802939,0,0,1.54270727315431,1.125086511040914,CLK1
GO_Biological_Process_2023,Regulation Of Blood Vessel Endothelial Cell Migration (GO:0043535),1/54,0.4822495402261153,0.5465698012802939,0,0,1.54270727315431,1.125086511040914,APOE
GO_Biological_Process_2023,Regulation Of Intracellular Signal Transduction (GO:1902531),4/297,0.4851429074413126,0.5495017264954349,0,0,1.1165285226718673,0.8075982297252535,PREX2;ZFAND6;ARHGEF28;ARHGAP6
GO_Biological_Process_2023,"Regulation Of Synaptic Transmission, Glutamatergic (GO:0051966)",1/55,0.4885312673038192,0.5519449037654366,0,0,1.5140617796219455,1.0846008853592184,GRIK3
GO_Biological_Process_2023,Response To Peptide Hormone (GO:0043434),1/55,0.4885312673038192,0.5519449037654366,0,0,1.5140617796219455,1.0846008853592184,STAT1
GO_Biological_Process_2023,Neuron Migration (GO:0001764),1/55,0.4885312673038192,0.5519449037654366,0,0,1.5140617796219455,1.0846008853592184,NRCAM
GO_Biological_Process_2023,Purine Ribonucleotide Biosynthetic Process (GO:0009152),1/55,0.4885312673038192,0.5519449037654366,0,0,1.5140617796219455,1.0846008853592184,ADCY2
GO_Biological_Process_2023,RNA Polymerase II Preinitiation Complex Assembly (GO:0051123),1/56,0.4947370907787164,0.557200756134572,0,0,1.486457940399849,1.0460632436998472,GTF2A1
GO_Biological_Process_2023,Regulation Of Stem Cell Population Maintenance (GO:2000036),1/56,0.4947370907787164,0.557200756134572,0,0,1.486457940399849,1.0460632436998472,PTN
GO_Biological_Process_2023,Positive Regulation Of DNA-templated Transcription Initiation (GO:2000144),1/56,0.4947370907787164,0.557200756134572,0,0,1.486457940399849,1.0460632436998472,GTF2A1
GO_Biological_Process_2023,post-Golgi Vesicle-Mediated Transport (GO:0006892),1/56,0.4947370907787164,0.557200756134572,0,0,1.486457940399849,1.0460632436998472,EPS15
GO_Biological_Process_2023,Regulation Of Cation Channel Activity (GO:2001257),1/56,0.4947370907787164,0.557200756134572,0,0,1.486457940399849,1.0460632436998472,CACNB2
GO_Biological_Process_2023,Potassium Ion Transmembrane Transport (GO:0071805),2/137,0.4954736194804899,0.5576799747197227,0,0,1.2112962962962963,0.8506221244882494,SLC1A3;ATP1B2
GO_Biological_Process_2023,Regulation Of Transcription Initiation By RNA Polymerase II (GO:0060260),1/57,0.500867924051296,0.5623395039599084,0,0,1.4598399525785417,1.009352083616913,GTF2A1
GO_Biological_Process_2023,Membrane Lipid Biosynthetic Process (GO:0046467),1/57,0.500867924051296,0.5623395039599084,0,0,1.4598399525785417,1.009352083616913,KDSR
GO_Biological_Process_2023,Monoatomic Anion Transport (GO:0006820),1/57,0.500867924051296,0.5623395039599084,0,0,1.4598399525785417,1.009352083616913,TSPO
GO_Biological_Process_2023,Positive Regulation Of Interleukin-1 Beta Production (GO:0032731),1/57,0.500867924051296,0.5623395039599084,0,0,1.4598399525785417,1.009352083616913,FZD5
GO_Biological_Process_2023,Renal System Development (GO:0072001),1/58,0.5069246695595153,0.5680724578251318,0,0,1.4341559292421926,0.974355308751954,STAT1
GO_Biological_Process_2023,Glycosaminoglycan Biosynthetic Process (GO:0006024),1/58,0.5069246695595153,0.5680724578251318,0,0,1.4341559292421926,0.974355308751954,HS3ST3A1
GO_Biological_Process_2023,Muscle Organ Development (GO:0007517),1/58,0.5069246695595153,0.5680724578251318,0,0,1.4341559292421926,0.974355308751954,VAMP5
GO_Biological_Process_2023,Anterior/Posterior Pattern Specification (GO:0009952),1/59,0.5129082190100982,0.5719181820181009,0,0,1.409357561882959,0.9409693586027824,BHLHE41
GO_Biological_Process_2023,Regulation Of Multicellular Organismal Development (GO:2000026),1/59,0.5129082190100982,0.5719181820181009,0,0,1.409357561882959,0.9409693586027824,PTN
GO_Biological_Process_2023,Chordate Embryonic Development (GO:0043009),1/59,0.5129082190100982,0.5719181820181009,0,0,1.409357561882959,0.9409693586027824,PTCH1
GO_Biological_Process_2023,Transcription Preinitiation Complex Assembly (GO:0070897),1/59,0.5129082190100982,0.5719181820181009,0,0,1.409357561882959,0.9409693586027824,GTF2A1
GO_Biological_Process_2023,Heart Morphogenesis (GO:0003007),1/59,0.5129082190100982,0.5719181820181009,0,0,1.409357561882959,0.9409693586027824,SOX9
GO_Biological_Process_2023,Negative Regulation Of Cytokine-Mediated Signaling Pathway (GO:0001960),1/59,0.5129082190100982,0.5719181820181009,0,0,1.409357561882959,0.9409693586027824,GSTP1
GO_Biological_Process_2023,Phospholipid Transport (GO:0015914),1/59,0.5129082190100982,0.5719181820181009,0,0,1.409357561882959,0.9409693586027824,APOE
GO_Biological_Process_2023,Regulation Of Cell Death (GO:0010941),1/59,0.5129082190100982,0.5719181820181009,0,0,1.409357561882959,0.9409693586027824,CLU
GO_Biological_Process_2023,Protein Polyubiquitination (GO:0000209),3/226,0.51690049624556,0.5760115536160901,0,0,1.099592847627446,0.7256266935724878,ANAPC13;IFI27;BCL2
GO_Biological_Process_2023,Sterol Metabolic Process (GO:0016125),1/60,0.5188194532507087,0.577073994837792,0,0,1.3853998171460722,0.9090984326448864,APOE
GO_Biological_Process_2023,Homophilic Cell Adhesion Via Plasma Membrane Adhesion Molecules (GO:0007156),1/60,0.5188194532507087,0.577073994837792,0,0,1.3853998171460722,0.9090984326448864,CADM1
GO_Biological_Process_2023,protein-DNA Complex Organization (GO:0071824),1/60,0.5188194532507087,0.577073994837792,0,0,1.3853998171460722,0.9090984326448864,HMGB2
GO_Biological_Process_2023,Regulation Of Cell Adhesion (GO:0030155),2/144,0.5219950363204312,0.5802461873047322,0,0,1.151173708920188,0.7483748050085676,MDK;IL18
GO_Biological_Process_2023,BMP Signaling Pathway (GO:0030509),1/61,0.5246592427680314,0.5821250137890349,0,0,1.362240663900415,0.8786537946883544,DDX5
GO_Biological_Process_2023,Negative Regulation Of Autophagy (GO:0010507),1/61,0.5246592427680314,0.5821250137890349,0,0,1.362240663900415,0.8786537946883544,BCL2
GO_Biological_Process_2023,Positive Regulation Of Organelle Assembly (GO:1902117),1/61,0.5246592427680314,0.5821250137890349,0,0,1.362240663900415,0.8786537946883544,SDC4
GO_Biological_Process_2023,Protein Transport (GO:0015031),4/313,0.5261581159320351,0.5834270265096715,0,0,1.05784449702211,0.6792985576268107,ROMO1;APOE;VAMP5;CLU
GO_Biological_Process_2023,Regulation Of Embryonic Development (GO:0045995),1/62,0.5304284474797203,0.5859878042705721,0,0,1.3398408271546154,0.8495531513407373,PLCB1
GO_Biological_Process_2023,Cell Junction Organization (GO:0034330),1/62,0.5304284474797203,0.5859878042705721,0,0,1.3398408271546154,0.8495531513407373,TJP1
GO_Biological_Process_2023,Spliceosomal Complex Assembly (GO:0000245),1/62,0.5304284474797203,0.5859878042705721,0,0,1.3398408271546154,0.8495531513407373,RSRP1
GO_Biological_Process_2023,Fat Cell Differentiation (GO:0045444),1/62,0.5304284474797203,0.5859878042705721,0,0,1.3398408271546154,0.8495531513407373,PSMB8
GO_Biological_Process_2023,Phosphatidylinositol-Mediated Signaling (GO:0048015),1/62,0.5304284474797203,0.5859878042705721,0,0,1.3398408271546154,0.8495531513407373,PLCB1
GO_Biological_Process_2023,Protein-Containing Complex Disassembly (GO:0032984),1/62,0.5304284474797203,0.5859878042705721,0,0,1.3398408271546154,0.8495531513407373,LIX1
GO_Biological_Process_2023,Positive Regulation Of Mitotic Cell Cycle Phase Transition (GO:1901992),1/63,0.5361279170474951,0.5915552955484054,0,0,1.3181635657877124,0.8217200926908264,PLCB1
GO_Biological_Process_2023,Regulation Of Cellular Catabolic Process (GO:0031329),1/63,0.5361279170474951,0.5915552955484054,0,0,1.3181635657877124,0.8217200926908264,PSAP
GO_Biological_Process_2023,Endocytic Recycling (GO:0032456),1/64,0.5417584908747592,0.5963001682863373,0,0,1.2971744714483304,0.7950835900844957,EPS15
GO_Biological_Process_2023,Negative Regulation Of Cell Death (GO:0060548),1/64,0.5417584908747592,0.5963001682863373,0,0,1.2971744714483304,0.7950835900844957,MT3
GO_Biological_Process_2023,Positive Regulation Of Interleukin-1 Production (GO:0032732),1/64,0.5417584908747592,0.5963001682863373,0,0,1.2971744714483304,0.7950835900844957,FZD5
GO_Biological_Process_2023,Positive Regulation Of Type I Interferon Production (GO:0032481),1/64,0.5417584908747592,0.5963001682863373,0,0,1.2971744714483304,0.7950835900844957,STAT1
GO_Biological_Process_2023,Positive Regulation Of DNA-templated Transcription (GO:0045893),15/1243,0.5425222834803439,0.5967745118283784,0,0,0.9971085824161632,0.6097579414982149,GTF2A1;NFAT5;FZD5;PRRX1;STAT1;IL18;HMGB2;ARRB1;NR1D1;RORB;MT3;SOX9;APOE;PLCB1;JUNB
GO_Biological_Process_2023,Regulation Of Endocytosis (GO:0030100),1/66,0.5528162591778136,0.6077250476430532,0,0,1.257133737631663,0.7451403706086028,APOE
