Gene_set,Term,Overlap,P-value,Adjusted P-value,Old P-value,Old Adjusted P-value,Odds Ratio,Combined Score,Genes
GO_Biological_Process_2023,Pharyngeal System Development (GO:0060037),1/16,0.1770450780603883,0.3575119678707648,0,0,5.461410788381743,9.45561848660738,PTCH1
GO_Biological_Process_2023,Positive Regulation Of Collagen Metabolic Process (GO:0010714),1/16,0.1770450780603883,0.3575119678707648,0,0,5.461410788381743,9.45561848660738,VSIR
GO_Biological_Process_2023,Positive Regulation Of Smooth Muscle Cell Migration (GO:0014911),1/16,0.1770450780603883,0.3575119678707648,0,0,5.461410788381743,9.45561848660738,MDK
GO_Biological_Process_2023,Protein O-linked Mannosylation (GO:0035269),1/16,0.1770450780603883,0.3575119678707648,0,0,5.461410788381743,9.45561848660738,TMTC2
GO_Biological_Process_2023,Protein Targeting To Peroxisome (GO:0006625),1/16,0.1770450780603883,0.3575119678707648,0,0,5.461410788381743,9.45561848660738,ZFAND6
GO_Biological_Process_2023,Regulation Of Golgi Organization (GO:1903358),1/16,0.1770450780603883,0.3575119678707648,0,0,5.461410788381743,9.45561848660738,PDE4DIP
GO_Biological_Process_2023,Inorganic Anion Transmembrane Transport (GO:0098661),2/63,0.1770611419237251,0.3575119678707648,0,0,2.69084699453552,4.658556229131611,GLRB;SLC1A3
GO_Biological_Process_2023,Oxidative Phosphorylation (GO:0006119),2/63,0.1770611419237251,0.3575119678707648,0,0,2.69084699453552,4.658556229131611,NDUFA3;NDUFC2
GO_Biological_Process_2023,Phosphatidylinositol Metabolic Process (GO:0046488),2/63,0.1770611419237251,0.3575119678707648,0,0,2.69084699453552,4.658556229131611,INPP4B;PLCB1
GO_Biological_Process_2023,Protein Polymerization (GO:0051258),2/63,0.1770611419237251,0.3575119678707648,0,0,2.69084699453552,4.658556229131611,GSN;ARHGAP6
GO_Biological_Process_2023,Negative Regulation Of DNA-templated Transcription (GO:0045892),16/1025,0.179375941193412,0.3612726435970669,0,0,1.3155231237447047,2.260425819308053,DDX5;STAT1;PTCH1;BHLHE41;HMGB2;NR1D1;RORB;GCLC;PER3;NR6A1;DACH1;IFI27;SOX9;CPEB3;PLCB1;CRYM
GO_Biological_Process_2023,Positive Regulation Of T Cell Differentiation (GO:0045582),2/64,0.1814015645328475,0.3612726435970669,0,0,2.6473118279569894,4.51907278601826,MDK;VSIR
GO_Biological_Process_2023,Positive Regulation Of Cellular Process (GO:0048522),10/594,0.1848608685921891,0.3612726435970669,0,0,1.4151806802078413,2.3890398105064947,TJP1;LGI1;IL15;MDK;COX17;BCL2;ROMO1;SOX9;PTN;PHPT1
GO_Biological_Process_2023,RNA Export From Nucleus (GO:0006405),2/65,0.1857578011583674,0.3612726435970669,0,0,2.6051587301587302,4.385293905381655,HNRNPA2B1;THOC2
GO_Biological_Process_2023,Antimicrobial Humoral Immune Response Mediated By Antimicrobial Peptide (GO:0061844),2/65,0.1857578011583674,0.3612726435970669,0,0,2.6051587301587302,4.385293905381655,ROMO1;CXCL14
GO_Biological_Process_2023,Canonical Wnt Signaling Pathway (GO:0060070),2/65,0.1857578011583674,0.3612726435970669,0,0,2.6051587301587302,4.385293905381655,FZD5;FRZB
GO_Biological_Process_2023,Regulation Of Tyrosine Phosphorylation Of STAT Protein (GO:0042509),2/65,0.1857578011583674,0.3612726435970669,0,0,2.6051587301587302,4.385293905381655,IL15;IL18
GO_Biological_Process_2023,Positive Regulation Of T Cell Proliferation (GO:0042102),2/65,0.1857578011583674,0.3612726435970669,0,0,2.6051587301587302,4.385293905381655,IL15;IL18
GO_Biological_Process_2023,G Protein-Coupled Acetylcholine Receptor Signaling Pathway (GO:0007213),1/17,0.187010790926784,0.3612726435970669,0,0,5.119813278008299,8.583822410474758,PLCB1
GO_Biological_Process_2023,Regulation Of Establishment Of Cell Polarity (GO:2000114),1/17,0.187010790926784,0.3612726435970669,0,0,5.119813278008299,8.583822410474758,GSN
GO_Biological_Process_2023,T Cell Migration (GO:0072678),1/17,0.187010790926784,0.3612726435970669,0,0,5.119813278008299,8.583822410474758,S1PR1
GO_Biological_Process_2023,Amyloid Precursor Protein Metabolic Process (GO:0042982),1/17,0.187010790926784,0.3612726435970669,0,0,5.119813278008299,8.583822410474758,APOE
GO_Biological_Process_2023,Androgen Receptor Signaling Pathway (GO:0030521),1/17,0.187010790926784,0.3612726435970669,0,0,5.119813278008299,8.583822410474758,DDX5
GO_Biological_Process_2023,Regulation Of Telomerase RNA Localization To Cajal Body (GO:1904872),1/17,0.187010790926784,0.3612726435970669,0,0,5.119813278008299,8.583822410474758,NOP10
GO_Biological_Process_2023,Regulation Of Telomere Maintenance Via Telomere Lengthening (GO:1904356),1/17,0.187010790926784,0.3612726435970669,0,0,5.119813278008299,8.583822410474758,HNRNPA2B1
GO_Biological_Process_2023,Central Nervous System Neuron Development (GO:0021954),1/17,0.187010790926784,0.3612726435970669,0,0,5.119813278008299,8.583822410474758,MAP2
GO_Biological_Process_2023,Response To Interferon-Alpha (GO:0035455),1/17,0.187010790926784,0.3612726435970669,0,0,5.119813278008299,8.583822410474758,BST2
GO_Biological_Process_2023,Sulfur Amino Acid Metabolic Process (GO:0000096),1/17,0.187010790926784,0.3612726435970669,0,0,5.119813278008299,8.583822410474758,GCLC
GO_Biological_Process_2023,Intracellular Estrogen Receptor Signaling Pathway (GO:0030520),1/17,0.187010790926784,0.3612726435970669,0,0,5.119813278008299,8.583822410474758,DDX5
GO_Biological_Process_2023,Intracellular Zinc Ion Homeostasis (GO:0006882),1/17,0.187010790926784,0.3612726435970669,0,0,5.119813278008299,8.583822410474758,MT3
GO_Biological_Process_2023,ncRNA Metabolic Process (GO:0034660),1/17,0.187010790926784,0.3612726435970669,0,0,5.119813278008299,8.583822410474758,ZCCHC7
GO_Biological_Process_2023,Negative Regulation Of Fibroblast Proliferation (GO:0048147),1/17,0.187010790926784,0.3612726435970669,0,0,5.119813278008299,8.583822410474758,GSTP1
GO_Biological_Process_2023,Negative Regulation Of Interleukin-8 Production (GO:0032717),1/17,0.187010790926784,0.3612726435970669,0,0,5.119813278008299,8.583822410474758,ARRB1
GO_Biological_Process_2023,Negative Regulation Of Oxidative Stress-Induced Intrinsic Apoptotic Signaling Pathway (GO:1902176),1/17,0.187010790926784,0.3612726435970669,0,0,5.119813278008299,8.583822410474758,PPIA
GO_Biological_Process_2023,Negative Regulation Of Striated Muscle Cell Differentiation (GO:0051154),1/17,0.187010790926784,0.3612726435970669,0,0,5.119813278008299,8.583822410474758,BHLHE41
GO_Biological_Process_2023,Neural Tube Development (GO:0021915),1/17,0.187010790926784,0.3612726435970669,0,0,5.119813278008299,8.583822410474758,PTCH1
GO_Biological_Process_2023,Nicotinamide Nucleotide Metabolic Process (GO:0046496),1/17,0.187010790926784,0.3612726435970669,0,0,5.119813278008299,8.583822410474758,ME1
GO_Biological_Process_2023,Polyol Metabolic Process (GO:0019751),1/17,0.187010790926784,0.3612726435970669,0,0,5.119813278008299,8.583822410474758,INPP4B
GO_Biological_Process_2023,Positive Regulation Of Alpha-Beta T Cell Proliferation (GO:0046641),1/17,0.187010790926784,0.3612726435970669,0,0,5.119813278008299,8.583822410474758,IL18
GO_Biological_Process_2023,Positive Regulation Of Amyloid-Beta Formation (GO:1902004),1/17,0.187010790926784,0.3612726435970669,0,0,5.119813278008299,8.583822410474758,CLU
GO_Biological_Process_2023,Positive Regulation Of Macrophage Derived Foam Cell Differentiation (GO:0010744),1/17,0.187010790926784,0.3612726435970669,0,0,5.119813278008299,8.583822410474758,IL18
GO_Biological_Process_2023,Positive Regulation Of Nitric-Oxide Synthase Activity (GO:0051000),1/17,0.187010790926784,0.3612726435970669,0,0,5.119813278008299,8.583822410474758,APOE
GO_Biological_Process_2023,Positive Regulation Of Potassium Ion Transmembrane Transport (GO:1901381),1/17,0.187010790926784,0.3612726435970669,0,0,5.119813278008299,8.583822410474758,ATP1B2
GO_Biological_Process_2023,Positive Regulation Of Regulatory T Cell Differentiation (GO:0045591),1/17,0.187010790926784,0.3612726435970669,0,0,5.119813278008299,8.583822410474758,VSIR
GO_Biological_Process_2023,Positive Regulation Of Small GTPase Mediated Signal Transduction (GO:0051057),1/17,0.187010790926784,0.3612726435970669,0,0,5.119813278008299,8.583822410474758,MMD2
GO_Biological_Process_2023,Positive Regulation Of Transcription From RNA Polymerase II Promoter In Response To Stress (GO:0036003),1/17,0.187010790926784,0.3612726435970669,0,0,5.119813278008299,8.583822410474758,HSPA5
GO_Biological_Process_2023,Postsynaptic Membrane Organization (GO:0001941),1/17,0.187010790926784,0.3612726435970669,0,0,5.119813278008299,8.583822410474758,GPHN
GO_Biological_Process_2023,rRNA Modification (GO:0000154),1/17,0.187010790926784,0.3612726435970669,0,0,5.119813278008299,8.583822410474758,NOP10
GO_Biological_Process_2023,Regulation Of Adenylate Cyclase Activity (GO:0045761),1/17,0.187010790926784,0.3612726435970669,0,0,5.119813278008299,8.583822410474758,GABBR2
GO_Biological_Process_2023,Negative Regulation Of Nucleic Acid-Templated Transcription (GO:1903507),8/456,0.1894110161977201,0.3612726435970669,0,0,1.4735958485958487,2.451821728415664,GCLC;DACH1;BHLHE41;HMGB2;SOX9;NR1D1;RORB;PLCB1
GO_Biological_Process_2023,Neuron Projection Guidance (GO:0097485),3/124,0.1900808098384191,0.3612726435970669,0,0,2.037103634288876,3.3822153505817454,LGI1;NRCAM;LGR6
GO_Biological_Process_2023,Cellular Response To BMP Stimulus (GO:0071773),2/66,0.1901288392837983,0.3612726435970669,0,0,2.564322916666667,4.256912810175382,DDX5;SOX9
GO_Biological_Process_2023,Proteasome-Mediated Ubiquitin-Dependent Protein Catabolic Process (GO:0043161),6/319,0.1909195481949021,0.3612726435970669,0,0,1.5794389992960416,2.6153980193953377,PSMB6;ANAPC13;IFI27;HSPA5;DNAJB9;ARRB1
GO_Biological_Process_2023,Regulation Of Mitotic Cell Cycle (GO:0007346),3/125,0.1931448908934626,0.3612726435970669,0,0,2.020303175800809,3.3220140926748747,ANAPC13;BTG1;SOX9
GO_Biological_Process_2023,Axonogenesis (GO:0007409),4/188,0.1939450703157034,0.3612726435970669,0,0,1.7879064669346,2.932488970160809,LGI1;SLITRK5;NRCAM;LGR6
GO_Biological_Process_2023,Extrinsic Apoptotic Signaling Pathway (GO:0097191),2/67,0.1945136884759205,0.3612726435970669,0,0,2.52474358974359,4.133643361700276,IFI27;BCL2
GO_Biological_Process_2023,Negative Regulation Of Cellular Catabolic Process (GO:0031330),2/67,0.1945136884759205,0.3612726435970669,0,0,2.52474358974359,4.133643361700276,BCL2;TIMP3
GO_Biological_Process_2023,Peptidyl-Tyrosine Phosphorylation (GO:0018108),2/67,0.1945136884759205,0.3612726435970669,0,0,2.52474358974359,4.133643361700276,CLK1;IL15
GO_Biological_Process_2023,Endocytosis (GO:0006897),4/189,0.1964071628601251,0.3612726435970669,0,0,1.7781512605042016,2.894057490594078,EEA1;APOE;CD302;EPS15
GO_Biological_Process_2023,Regulation Of Epithelial Cell Differentiation (GO:0030856),1/18,0.1968563149996287,0.3612726435970669,0,0,4.81840371003173,7.831260876445144,SOX9
GO_Biological_Process_2023,Regulation Of Exosomal Secretion (GO:1903541),1/18,0.1968563149996287,0.3612726435970669,0,0,4.81840371003173,7.831260876445144,SDC4
GO_Biological_Process_2023,Actin Filament Capping (GO:0051693),1/18,0.1968563149996287,0.3612726435970669,0,0,4.81840371003173,7.831260876445144,GSN
GO_Biological_Process_2023,Regulation Of Mitochondrial Membrane Permeability (GO:0046902),1/18,0.1968563149996287,0.3612726435970669,0,0,4.81840371003173,7.831260876445144,BCL2
GO_Biological_Process_2023,Barbed-End Actin Filament Capping (GO:0051016),1/18,0.1968563149996287,0.3612726435970669,0,0,4.81840371003173,7.831260876445144,GSN
GO_Biological_Process_2023,Regulation Of Oxidative Stress-Induced Intrinsic Apoptotic Signaling Pathway (GO:1902175),1/18,0.1968563149996287,0.3612726435970669,0,0,4.81840371003173,7.831260876445144,PPIA
GO_Biological_Process_2023,Cardiac Muscle Cell Contraction (GO:0086003),1/18,0.1968563149996287,0.3612726435970669,0,0,4.81840371003173,7.831260876445144,GSN
GO_Biological_Process_2023,Regulation Of Vascular Endothelial Cell Proliferation (GO:1905562),1/18,0.1968563149996287,0.3612726435970669,0,0,4.81840371003173,7.831260876445144,MDK
GO_Biological_Process_2023,Renal Absorption (GO:0070293),1/18,0.1968563149996287,0.3612726435970669,0,0,4.81840371003173,7.831260876445144,GSN
GO_Biological_Process_2023,Response To Cholesterol (GO:0070723),1/18,0.1968563149996287,0.3612726435970669,0,0,4.81840371003173,7.831260876445144,PTCH1
GO_Biological_Process_2023,Response To Ethanol (GO:0045471),1/18,0.1968563149996287,0.3612726435970669,0,0,4.81840371003173,7.831260876445144,GRIN3A
GO_Biological_Process_2023,Dendritic Cell Migration (GO:0036336),1/18,0.1968563149996287,0.3612726435970669,0,0,4.81840371003173,7.831260876445144,CLU
GO_Biological_Process_2023,Response To Organophosphorus (GO:0046683),1/18,0.1968563149996287,0.3612726435970669,0,0,4.81840371003173,7.831260876445144,STAT1
GO_Biological_Process_2023,Energy Reserve Metabolic Process (GO:0006112),1/18,0.1968563149996287,0.3612726435970669,0,0,4.81840371003173,7.831260876445144,MT3
GO_Biological_Process_2023,Excitatory Postsynaptic Potential (GO:0060079),1/18,0.1968563149996287,0.3612726435970669,0,0,4.81840371003173,7.831260876445144,GRID2
GO_Biological_Process_2023,fatty-acyl-CoA Metabolic Process (GO:0035337),1/18,0.1968563149996287,0.3612726435970669,0,0,4.81840371003173,7.831260876445144,ACSL3
GO_Biological_Process_2023,Glycerolipid Catabolic Process (GO:0046503),1/18,0.1968563149996287,0.3612726435970669,0,0,4.81840371003173,7.831260876445144,PRDX6
GO_Biological_Process_2023,Heart Trabecula Morphogenesis (GO:0061384),1/18,0.1968563149996287,0.3612726435970669,0,0,4.81840371003173,7.831260876445144,S1PR1
GO_Biological_Process_2023,Intracellular Sodium Ion Homeostasis (GO:0006883),1/18,0.1968563149996287,0.3612726435970669,0,0,4.81840371003173,7.831260876445144,ATP1B2
GO_Biological_Process_2023,Maintenance Of Gastrointestinal Epithelium (GO:0030277),1/18,0.1968563149996287,0.3612726435970669,0,0,4.81840371003173,7.831260876445144,SOX9
GO_Biological_Process_2023,Maintenance Of Protein Localization In Organelle (GO:0072595),1/18,0.1968563149996287,0.3612726435970669,0,0,4.81840371003173,7.831260876445144,HSPA5
GO_Biological_Process_2023,Membrane Repolarization (GO:0086009),1/18,0.1968563149996287,0.3612726435970669,0,0,4.81840371003173,7.831260876445144,ATP1B2
GO_Biological_Process_2023,Mesenchyme Morphogenesis (GO:0072132),1/18,0.1968563149996287,0.3612726435970669,0,0,4.81840371003173,7.831260876445144,SOX9
GO_Biological_Process_2023,Negative Regulation Of T Cell Receptor Signaling Pathway (GO:0050860),1/18,0.1968563149996287,0.3612726435970669,0,0,4.81840371003173,7.831260876445144,PHPT1
GO_Biological_Process_2023,Negative Regulation Of Nervous System Development (GO:0051961),1/18,0.1968563149996287,0.3612726435970669,0,0,4.81840371003173,7.831260876445144,B2M
GO_Biological_Process_2023,Negative Regulation Of Viral Entry Into Host Cell (GO:0046597),1/18,0.1968563149996287,0.3612726435970669,0,0,4.81840371003173,7.831260876445144,GSN
GO_Biological_Process_2023,Neutrophil Activation (GO:0042119),1/18,0.1968563149996287,0.3612726435970669,0,0,4.81840371003173,7.831260876445144,IL15
GO_Biological_Process_2023,Nitric Oxide Mediated Signal Transduction (GO:0007263),1/18,0.1968563149996287,0.3612726435970669,0,0,4.81840371003173,7.831260876445144,APOE
GO_Biological_Process_2023,Positive Regulation Of Chromosome Segregation (GO:0051984),1/18,0.1968563149996287,0.3612726435970669,0,0,4.81840371003173,7.831260876445144,SMC4
GO_Biological_Process_2023,Positive Regulation Of Glycolytic Process (GO:0045821),1/18,0.1968563149996287,0.3612726435970669,0,0,4.81840371003173,7.831260876445144,SLC4A4
GO_Biological_Process_2023,Positive Regulation Of Macrophage Migration (GO:1905523),1/18,0.1968563149996287,0.3612726435970669,0,0,4.81840371003173,7.831260876445144,MDK
GO_Biological_Process_2023,Positive Regulation Of Monocyte Chemotaxis (GO:0090026),1/18,0.1968563149996287,0.3612726435970669,0,0,4.81840371003173,7.831260876445144,PLA2G7
GO_Biological_Process_2023,Positive Regulation Of Natural Killer Cell Activation (GO:0032816),1/18,0.1968563149996287,0.3612726435970669,0,0,4.81840371003173,7.831260876445144,IL18
GO_Biological_Process_2023,Positive Regulation Of Neuroblast Proliferation (GO:0002052),1/18,0.1968563149996287,0.3612726435970669,0,0,4.81840371003173,7.831260876445144,BCAN
GO_Biological_Process_2023,Positive Regulation Of Neutrophil Chemotaxis (GO:0090023),1/18,0.1968563149996287,0.3612726435970669,0,0,4.81840371003173,7.831260876445144,MDK
GO_Biological_Process_2023,Protein Autoprocessing (GO:0016540),1/18,0.1968563149996287,0.3612726435970669,0,0,4.81840371003173,7.831260876445144,ASRGL1
GO_Biological_Process_2023,Protein Import Into Mitochondrial Matrix (GO:0030150),1/18,0.1968563149996287,0.3612726435970669,0,0,4.81840371003173,7.831260876445144,ROMO1
GO_Biological_Process_2023,Regulation Of RIG-I Signaling Pathway (GO:0039535),1/18,0.1968563149996287,0.3612726435970669,0,0,4.81840371003173,7.831260876445144,DDX60
GO_Biological_Process_2023,Regulation Of T Cell Cytokine Production (GO:0002724),1/18,0.1968563149996287,0.3612726435970669,0,0,4.81840371003173,7.831260876445144,FZD5
GO_Biological_Process_2023,Regulation Of Cell-Cell Adhesion Mediated By Cadherin (GO:2000047),1/18,0.1968563149996287,0.3612726435970669,0,0,4.81840371003173,7.831260876445144,TJP1
GO_Biological_Process_2023,Aerobic Electron Transport Chain (GO:0019646),2/68,0.1989113798497016,0.3642118851697881,0,0,2.4863636363636363,4.015218394618507,NDUFA3;NDUFC2
GO_Biological_Process_2023,Neuropeptide Signaling Pathway (GO:0007218),2/68,0.1989113798497016,0.3642118851697881,0,0,2.4863636363636363,4.015218394618507,GLRB;SORCS3
GO_Biological_Process_2023,Cellular Response To Calcium Ion (GO:0071277),2/69,0.2033209658151823,0.3642118851697881,0,0,2.4491293532338307,3.901388204983385,CPNE8;CLU
GO_Biological_Process_2023,Response To Molecule Of Bacterial Origin (GO:0002237),2/69,0.2033209658151823,0.3642118851697881,0,0,2.4491293532338307,3.901388204983385,FZD5;HMGB2
GO_Biological_Process_2023,Phagocytosis (GO:0006909),2/69,0.2033209658151823,0.3642118851697881,0,0,2.4491293532338307,3.901388204983385,GSN;CD302
GO_Biological_Process_2023,Positive Regulation Of Phosphatidylinositol 3-Kinase Signaling (GO:0014068),2/69,0.2033209658151823,0.3642118851697881,0,0,2.4491293532338307,3.901388204983385,IL18;SOX9
GO_Biological_Process_2023,Modification-Dependent Protein Catabolic Process (GO:0019941),4/192,0.2038506775678699,0.3642118851697881,0,0,1.7495083139638834,2.782361208762944,UBB;ARRB1;UBA52;HERC6
GO_Biological_Process_2023,Protein Localization To Membrane (GO:0072657),4/192,0.2038506775678699,0.3642118851697881,0,0,1.7495083139638834,2.782361208762944,CACNB2;PTCH1;BSG;PTN
GO_Biological_Process_2023,Protein Targeting (GO:0006605),3/129,0.2055214929693779,0.3642118851697881,0,0,1.9557680812910936,3.094425375728102,ZFAND6;SEC61G;TSPO
GO_Biological_Process_2023,NADP Metabolic Process (GO:0006739),1/19,0.2065830938191157,0.3642118851697881,0,0,4.550484094052559,7.176352572213125,ME1
GO_Biological_Process_2023,Regulation Of Granulocyte Chemotaxis (GO:0071622),1/19,0.2065830938191157,0.3642118851697881,0,0,4.550484094052559,7.176352572213125,MDK
GO_Biological_Process_2023,RNA-templated DNA Biosynthetic Process (GO:0006278),1/19,0.2065830938191157,0.3642118851697881,0,0,4.550484094052559,7.176352572213125,NOP10
GO_Biological_Process_2023,Regulation Of Megakaryocyte Differentiation (GO:0045652),1/19,0.2065830938191157,0.3642118851697881,0,0,4.550484094052559,7.176352572213125,HMGB2
GO_Biological_Process_2023,Bicarbonate Transport (GO:0015701),1/19,0.2065830938191157,0.3642118851697881,0,0,4.550484094052559,7.176352572213125,SLC4A4
GO_Biological_Process_2023,Calcium-Independent Cell-Cell Adhesion Via Plasma Membrane Cell-Adhesion Molecules (GO:0016338),1/19,0.2065830938191157,0.3642118851697881,0,0,4.550484094052559,7.176352572213125,CLDN10
GO_Biological_Process_2023,Regulation Of Vascular Endothelial Growth Factor Signaling Pathway (GO:1900746),1/19,0.2065830938191157,0.3642118851697881,0,0,4.550484094052559,7.176352572213125,CCBE1
GO_Biological_Process_2023,Response To Fatty Acid (GO:0070542),1/19,0.2065830938191157,0.3642118851697881,0,0,4.550484094052559,7.176352572213125,SOX9
GO_Biological_Process_2023,Cyclic Nucleotide Biosynthetic Process (GO:0009190),1/19,0.2065830938191157,0.3642118851697881,0,0,4.550484094052559,7.176352572213125,ADCY2
GO_Biological_Process_2023,Sphingosine Metabolic Process (GO:0006670),1/19,0.2065830938191157,0.3642118851697881,0,0,4.550484094052559,7.176352572213125,NAAA
GO_Biological_Process_2023,Establishment Of Skin Barrier (GO:0061436),1/19,0.2065830938191157,0.3642118851697881,0,0,4.550484094052559,7.176352572213125,IL18
GO_Biological_Process_2023,tRNA Metabolic Process (GO:0006399),1/19,0.2065830938191157,0.3642118851697881,0,0,4.550484094052559,7.176352572213125,SSB
GO_Biological_Process_2023,Telomere Maintenance Via Telomerase (GO:0007004),1/19,0.2065830938191157,0.3642118851697881,0,0,4.550484094052559,7.176352572213125,NOP10
GO_Biological_Process_2023,Glycogen Metabolic Process (GO:0005977),1/19,0.2065830938191157,0.3642118851697881,0,0,4.550484094052559,7.176352572213125,NR1D1
GO_Biological_Process_2023,Heme Biosynthetic Process (GO:0006783),1/19,0.2065830938191157,0.3642118851697881,0,0,4.550484094052559,7.176352572213125,TSPO
GO_Biological_Process_2023,Xenobiotic Catabolic Process (GO:0042178),1/19,0.2065830938191157,0.3642118851697881,0,0,4.550484094052559,7.176352572213125,GSTM1
GO_Biological_Process_2023,Inositol Phosphate-Mediated Signaling (GO:0048016),1/19,0.2065830938191157,0.3642118851697881,0,0,4.550484094052559,7.176352572213125,NFAT5
GO_Biological_Process_2023,Interleukin-1-Mediated Signaling Pathway (GO:0070498),1/19,0.2065830938191157,0.3642118851697881,0,0,4.550484094052559,7.176352572213125,PLCB1
GO_Biological_Process_2023,Linoleic Acid Metabolic Process (GO:0043651),1/19,0.2065830938191157,0.3642118851697881,0,0,4.550484094052559,7.176352572213125,GSTP1
GO_Biological_Process_2023,Mesoderm Development (GO:0007498),1/19,0.2065830938191157,0.3642118851697881,0,0,4.550484094052559,7.176352572213125,MEST
GO_Biological_Process_2023,Negative Regulation Of RNA Splicing (GO:0033119),1/19,0.2065830938191157,0.3642118851697881,0,0,4.550484094052559,7.176352572213125,PTBP3
GO_Biological_Process_2023,Negative Regulation Of Fatty Acid Metabolic Process (GO:0045922),1/19,0.2065830938191157,0.3642118851697881,0,0,4.550484094052559,7.176352572213125,SOX9
GO_Biological_Process_2023,Neuron Apoptotic Process (GO:0051402),1/19,0.2065830938191157,0.3642118851697881,0,0,4.550484094052559,7.176352572213125,BCL2
GO_Biological_Process_2023,Nucleotide Biosynthetic Process (GO:0009165),1/19,0.2065830938191157,0.3642118851697881,0,0,4.550484094052559,7.176352572213125,ME1
GO_Biological_Process_2023,Oligodendrocyte Differentiation (GO:0048709),1/19,0.2065830938191157,0.3642118851697881,0,0,4.550484094052559,7.176352572213125,SOX9
GO_Biological_Process_2023,Phosphatidylcholine Biosynthetic Process (GO:0006656),1/19,0.2065830938191157,0.3642118851697881,0,0,4.550484094052559,7.176352572213125,PCYT1B
GO_Biological_Process_2023,Positive Regulation Of Activated T Cell Proliferation (GO:0042104),1/19,0.2065830938191157,0.3642118851697881,0,0,4.550484094052559,7.176352572213125,IL18
GO_Biological_Process_2023,rRNA Catabolic Process (GO:0016075),1/19,0.2065830938191157,0.3642118851697881,0,0,4.550484094052559,7.176352572213125,ZCCHC7
GO_Biological_Process_2023,Receptor Clustering (GO:0043113),1/19,0.2065830938191157,0.3642118851697881,0,0,4.550484094052559,7.176352572213125,PTN
GO_Biological_Process_2023,Regulation Of Acute Inflammatory Response (GO:0002673),1/19,0.2065830938191157,0.3642118851697881,0,0,4.550484094052559,7.176352572213125,GSTP1
GO_Biological_Process_2023,Regulation Of Autophagy Of Mitochondrion (GO:1903146),1/19,0.2065830938191157,0.3642118851697881,0,0,4.550484094052559,7.176352572213125,FZD5
GO_Biological_Process_2023,Sulfur Compound Biosynthetic Process (GO:0044272),2/70,0.2077415195909516,0.3644623724330492,0,0,2.4129901960784315,3.791919181401081,GSTM1;GSTP1
GO_Biological_Process_2023,Mitochondrial ATP Synthesis Coupled Electron Transport (GO:0042775),2/70,0.2077415195909516,0.3644623724330492,0,0,2.4129901960784315,3.791919181401081,NDUFA3;NDUFC2
GO_Biological_Process_2023,Negative Regulation Of Extrinsic Apoptotic Signaling Pathway (GO:2001237),2/70,0.2077415195909516,0.3644623724330492,0,0,2.4129901960784315,3.791919181401081,GSTP1;BCL2
GO_Biological_Process_2023,Positive Regulation Of Protein Transport (GO:0051222),2/70,0.2077415195909516,0.3644623724330492,0,0,2.4129901960784315,3.791919181401081,ACSL3;PPIA
GO_Biological_Process_2023,Regulation Of G Protein-Coupled Receptor Signaling Pathway (GO:0008277),2/70,0.2077415195909516,0.3644623724330492,0,0,2.4129901960784315,3.791919181401081,RGS20;PLCB1
GO_Biological_Process_2023,Regulation Of Programmed Cell Death (GO:0043067),4/195,0.2113763865856852,0.3698790540261139,0,0,1.7217651458489154,2.675820888034829,STAT1;SOX9;CLU;CTSB
GO_Biological_Process_2023,Myeloid Leukocyte Differentiation (GO:0002573),2/71,0.2121721349911354,0.3698790540261139,0,0,2.377898550724637,3.6865925581232704,IL15;PIR
GO_Biological_Process_2023,Negative Regulation Of Protein Binding (GO:0032091),2/71,0.2121721349911354,0.3698790540261139,0,0,2.377898550724637,3.6865925581232704,MAP2;B2M
GO_Biological_Process_2023,T Cell Mediated Immunity (GO:0002456),1/20,0.2161925536081246,0.3698790540261139,0,0,4.3107665429133,6.602308895436678,CADM1
GO_Biological_Process_2023,Regulation Of Macrophage Chemotaxis (GO:0010758),1/20,0.2161925536081246,0.3698790540261139,0,0,4.3107665429133,6.602308895436678,MDK
GO_Biological_Process_2023,Regulation Of Meiotic Cell Cycle (GO:0051445),1/20,0.2161925536081246,0.3698790540261139,0,0,4.3107665429133,6.602308895436678,ANAPC13
GO_Biological_Process_2023,Anterior/Posterior Axis Specification (GO:0009948),1/20,0.2161925536081246,0.3698790540261139,0,0,4.3107665429133,6.602308895436678,FZD5
